{
  "name": "echo",
  "version": "1.0.0",
  "base_url": "https://httpbin.org",
  "capabilities": [
    {
      "tool": "echo.get_ip",
      "method": "GET",
      "path": "/ip",
      "inputs": {}
    }
  ],
  "meta": {
    "title": "Echo",
    "description": "Demo httpbin endpoints",
    "category": "other",
    "homepage": "https://httpbin.org/",
    "repo": "https://github.com",
    "license": "MIT",
    "badges": [
      "community"
    ],
    "keywords": {
      "en": [
        "demo",
        "httpbin",
        "echo"
      ],
      "ru": [
        "демо",
        "httpbin",
        "echo"
      ]
    },
    "capabilities": [
      "REST API"
    ]
  }
}
